매장,주소,지역
뚜레쥬르 청주시청,충북 청주시 상당구 중앙로 80 1층,충북
뚜레쥬르 청주오창센트럴파크,충북 청주시 청원구 오창공원로96 한신더휴 상가,충북
뚜레쥬르 청주사천,충북 청주시 청원구 율봉로 43,충북
뚜레쥬르 청주강서,충북 청주시 흥덕구 서현중로35 1층 뚜레쥬르,충북
뚜레쥬르 충주푸르지오,충북 충주 봉현로 355,충북
뚜레쥬르 충북괴산,충청북도 괴산군 괴산읍 읍내로11길 3,충북
뚜레쥬르 충북단양,"충청북도 단양군 단양읍 삼봉로 293-1 (도전리,명진당) 1층 뚜레쥬르 충북단양점",충북
뚜레쥬르 충북보은,충청북도 보은군 보은읍 삼산로 15,충북
뚜레쥬르 충북영동중앙,충청북도 영동군 영동읍 중앙로 46,충북
뚜레쥬르 충북옥천,"충청북도 옥천군 옥천읍 문장로 88-10 (장야리,소매점) 뚜레쥬르 충북옥천",충북
뚜레쥬르 옥천양수,"충청북도 옥천군 옥천읍 양수로 23-7 (양수리) 101,102호",충북
뚜레쥬르 충북금왕,충청북도 음성군 금왕읍 금석로 86,충북
뚜레쥬르 충북금왕중앙,충청북도 음성군 금왕읍 무극로 224,충북
뚜레쥬르 음성공장,충청북도 음성군 대소면 대소산단로 20 음성공장 (CJ푸드빌),충북
뚜레쥬르 충북혁신도시,충청북도 음성군 맹동면 대하로 277,충북
뚜레쥬르 충북음성,충청북도 음성군 음성읍 수정로 55,충북
뚜레쥬르 제천청전,충청북도 제천시 내재로 242 1층 (청전동),충북
뚜레쥬르 제천고암,충청북도 제천시 용두천로46길 35 (고암동) 1층 뚜레쥬르,충북
뚜레쥬르 제천장락주공,충청북도 제천시 장락로 129 (장락동) 1층,충북
뚜레쥬르 제천비둘기,충청북도 제천시 청전대로 167-1 (청전동) 뚜레쥬르,충북
뚜레쥬르 제천중앙,충청북도 제천시 풍양로13길 14 (중앙로2가) 1층 뚜레쥬르,충북
뚜레쥬르 제천하소로,충청북도 제천시 하소로 42 (하소동) 1층 뚜레쥬르,충북
뚜레쥬르 증평하나로마트,충청북도 증평군 광장로 27,충북
뚜레쥬르 충북증평,충청북도 증평군 중앙로 202-0,충북
뚜레쥬르 충북광혜원,"충청북도 진천군 광혜원면 장기길 92 (광혜원리,경희우리한의원) 뚜레쥬르 충북광혜원",충북
뚜레쥬르 진천혁신도시,충청북도 진천군 덕산면 시가로 14,충북
뚜레쥬르 진천성모병원,충청북도 진천군 진천읍 중앙북로 33,충북
뚜레쥬르 진천장관,충청북도 진천군 진천읍 진광로 97-12 (장관리) 1층 뚜레쥬르,충북
뚜레쥬르 청원내수,충청북도 청원군 내수읍 청암로 54,충북
뚜레쥬르 오창한라,충청북도 청원군 오창읍 오창중앙로 96 한라비발디단지상가 106호,충북
뚜레쥬르 청주남문,"충청북도 청주시 상당구 남사로 137 (남문로2가,연합비뇨기과의원) 1층",충북
뚜레쥬르 청주방서,"충청북도 청주시 상당구 단재로 316 (방서동,청주센트럴자이) A동 111,112호 뚜레쥬르",충북
뚜레쥬르 청주금천장자,충청북도 청주시 상당구 수영로 303-1 (용담동),충북
뚜레쥬르 청주영운제일,충청북도 청주시 상당구 영운천로 29 (영운동) 1층,충북
뚜레쥬르 청주용암현대,충청북도 청주시 상당구 월평로184번길 8 (용암동),충북
뚜레쥬르 청주용암세원,"충청북도 청주시 상당구 월평로253번길 67 1동 상가 1층 123호 (용암동, 세원한아름아파트)",충북
뚜레쥬르 청주성모병원,충청북도 청주시 상당구 주성로 173-19 (주중동),충북
뚜레쥬르 청주동남,"충청북도 청주시 상당구 중고개로 140 (용암동,칸타빌더테라스1단지) 대원칸타빌 1차 상가 10",충북
뚜레쥬르 청주용암부영,충청북도 청주시 상당구 중흥로 199 (용암동) 1층,충북
뚜레쥬르 청주개신주공,충청북도 청주시 서원구 경신로 40 (개신동) 1층 뚜레쥬르,충북
뚜레쥬르 청주가마지구,충청북도 청주시 서원구 남이면 청남로 1827-32 (가마리) 1층,충북
뚜레쥬르 충대중문,충청북도 청주시 서원구 내수동로 112 1층,충북
뚜레쥬르 청주모충,충청북도 청주시 서원구 무심서로413번길 5,충북
뚜레쥬르 청주산남계룡,"충청북도 청주시 서원구 산남로 22 (산남동,산남렉슬Ⅱ) 1층",충북
뚜레쥬르 청주산남,충청북도 청주시 서원구 산남로 75 (산남동) 1층,충북
뚜레쥬르 청주분평주공,"충청북도 청주시 서원구 월평로 78 (분평동) 1층 뚜레쥬르(101호, 102호)",충북
뚜레쥬르 청주율량칸타빌,충청북도 청주시 청원구 율량로 135,충북
뚜레쥬르 청주율량,충청북도 청주시 청원구 율봉로 178 (율량동) 1층 뚜레쥬르,충북
뚜레쥬르 청주율량제일,충청북도 청주시 청원구 율중로 11 (율량동) 1층 102호(율량동),충북
뚜레쥬르 오창산업단지,"충청북도 청주시 청원구 주성1길 17, 1층",충북
뚜레쥬르 청주내덕중앙로,충청북도 청주시 청원구 중앙로 209 1층,충북
뚜레쥬르 청주비하계룡,충청북도 청주시 흥덕구 2순환로1168번길 26 (비하동) 1층 뚜레쥬르,충북
뚜레쥬르 청주가경,충청북도 청주시 흥덕구 가경로 155,충북
뚜레쥬르 청주가경주공,충청북도 청주시 흥덕구 가경로 16-2,충북
뚜레쥬르 청주지웰시티,"충청북도 청주시 흥덕구 대농로 39 (복대동) (복대동,LK트리플렉스)",충북
뚜레쥬르 청주복대어울림,충청북도 청주시 흥덕구 대신로73번길 1 (복대동),충북
뚜레쥬르 청주봉명아이파크,충청북도 청주시 흥덕구 덕암로114번길 37-0 (봉명동),충북
뚜레쥬르 청주가경아이파크,"충청북도 청주시 흥덕구 서현로68(가경동) 가경아이파크 2단지 상가동 B106, 107호",충북
뚜레쥬르 청주테크노폴리스,"충청북도 청주시 흥덕구 송화로214번길 29 (송절동,테크노폴리스우미린) 1층 뚜레쥬르",충북
뚜레쥬르 청주수곡사거리,"충청북도 청주시 흥덕구 수곡로 46-0 (수곡동, 세원청실아파트)",충북
뚜레쥬르 오송파라곤,충청북도 청주시 흥덕구 오송읍 오송생명7로 164,충북
뚜레쥬르 서청주파크자이,"충청북도 청주시 흥덕구 청향로9번길 40-6 (비하동,엄지어린이집) 충청북도 청주시 청향로 9번길",충북
뚜레쥬르 청주터미널,충청북도 청주시 흥덕구 풍산로 6 (가경동) 청주시외버스터미널 내 뚜레쥬르,충북
뚜레쥬르 충주터미널,"충청북도 충주시 계명대로 19 (칠금동,남영빌딩) 1층 뚜레쥬르",충북
뚜레쥬르 충주연수,충청북도 충주시 번영대로 103 (연수동),충북
뚜레쥬르 충주신연수,"충청북도 충주시 연수동산로 2 (연수동,골드프라자) 1층 뚜레쥬르",충북
뚜레쥬르 충주공판장,충청북도 충주시 염밭로 118 118 충주공판장(교현동),충북
뚜레쥬르 충주연수롯데,충청북도 충주시 예성로 392 (연수동) 1층 뚜레쥬르 연수롯데점,충북
뚜레쥬르 충주주덕,충청북도 충주시 주덕읍 신양로 124 (신양리) 뚜레쥬르 충주주덕점,충북
뚜레쥬르 서충주파라뷰,충청북도 충주시 주덕읍 화개2길 3 뚜레쥬르 서충주파라뷰,충북
뚜레쥬르 서충주신도시,충청북도 충주시 중앙탑면 원앙4길 21 (용전리) 1층 뚜레쥬르,충북
뚜레쥬르 충주용산호암,충청북도 충주시 형설로 50 (호암동) 다동 뚜레쥬르 충주용산호암점,충북
뚜레쥬르 충주호암신도시,"충청북도 충주시 호암수청1로 47 (호암동) 103호, 104호",충북
