cafe_title,cafe_content,cafe_replies,date
8일부터 여행을 가는데 발리벨리때문에 벌써부터 걱정입니다 ㅠㅠ 약이 있을까요??,"작년에 베트남 나트랑 가서도 물갈이때문에 3-4일을 날렸는데 찾아보니까 발리는 아예 발리벨리라고 검색어 상단에 노출될 정도로 흔하다던데...
제가 동남아 가면 보통 물갈이를 하는 편인데 뒤늦게 알게되서 장티푸스 주사라도 맞으려고 보니까 시간도 너무 늦었고 주사약도 없긴한데요
혹시 그외에 한국에서 챙겨가서 쓸 수 있는 약이 있을까요??
현지 물이나 얼음은 안먹고 생수로 먹긴 할텐데 글들을 찾아보니 수영장 물도 영향이 있다는 얘기들도 있으신데 혹시 좋은 약이나 방법 있으면 공유 좀 부탁드립니다 ㅜㅠ
","['숙소도 어느정도 괜찮은 급(4성이상)이고 식당도 좀 고급져보이는 곳들에서만 먹으면 괜찮아요ㅎ\n지금 우붓 정글 리조트에 있는데 여긴 우리나라보다 물이 더 깨끗한것 같아요ㅋㅋ', '그리고 전 미리 내과에서 장염약 상비약으로 타왔어요', '앗 그렇다면 다행이네요 저희도 좋은 곳으로만 이동이동 하긴 하는데 워낙 물갈이를 하는 편이라 ㅜㅠ\n즐거운 여행 되세요!!', '걍 맘 비우고 오셔요 어차피 복불복 전 발리밸리는 아닌데 물갈이인지 햇빛알러지인지 2틀째 두드러기 올라오고 가렵고해서 가져간 알러지약먹고 연고 사다 발랐어요 우붓 연고 드릅게 비쌈 ㅠㅠ', '운에 맡겨보겠습니다 ㅜㅠ\n작년에도 나트랑서 며칠을 망쳐서 ㅜㅠ', '케바케 인거같아요ㅜㅜ\n저희는 혹시 몰라 장티푸스 접종도 하고 같습니다~\n리조트나 호텔(5성) 내 레스토랑에서만 식사했고 로컬 음식점은 안갔어요;; 애 장염걸릴까봐요..\n그런데 딸도 저도 장염 걸렸어요... 4일차 저녁부터 몸이 안좋더라구요..\n발리에서 병원에 갔지만 크게 호전되지 않았습니다.. 약 처방이... 구토 억제제하고.. 유산균을 주시더라구요...\n아이랑 수영장에서 놀 때 주의 하시고, 얼음은 드시지 마시구요ㅠ\n혹시 모르니 여행자보험 들고가세요;\n\n그런데 발리는 너무 좋았어요......아퍼서 잘 못 놀아서 아쉬 울 뿐..', '제가 그 루트를 밞을까봐 걱정이네요\n그나마 즐거운 여행 되셨다니 다행입니다 ㅜㅠ\n장티푸스는 지금 맞을 수가 없어서 ㅜㅠ 맞아봤자 좀 많이 늦어버려서...', '걱정이 병을 키우기도 합니다... 모르고 있으면 넘어갈 일을... 아는 순간부터 조금만 이상해도 거기에 집중하게 되서 더 크게 느껴집니다... 뭘 잘못먹어서 아프기 보단... 여행의 피로로 컨디션 저하, 과도한 냉방으로 냉방병, 뜨거운 햇살 아래 무리한 야외활동에 의한 더위먹는게 더 빈번하게 일어 납니다... 발리 갔다 아프면 다 발리밸리라고 하는데... 여행을 많이 다니는 저로서는... 그냥 여행지에서 흔히 피로함으로 인해 겪게 되는 몸살이 더 맞는것 같습니다...', '제가 유럽이나 미주지역은 괜찮았는데 이상하게 동남아 여행을 가면 물갈이를 하는편이라 ㅠㅠ\n그래서 찾아보다보니 발리벨리라고 워낙 유명해서 걱정이 앞섰습니다 ㅠㅠ', '동남아 물갈이 많이 하셨으면\n장 에 내성이.생겨서 이번에는\n잘 견딜수도 있잖아요.\n\n장약.많이 챙겨가가고 노릿? 이라는 현지약 먹으면 좀낫데고 보험들어서 발병한다.싶으면 바로 병원가세요 고생하지말고요', '네 감사합니다 ㅜㅠ', '저희도 걱정이 많아서 장티푸스 주사도 맞고왔어요. (수십군데 보건소, 병원 전화 돌려봄) 그런데도 가족중에 가장 배탈 안나는 제가 발리밸리 증상이 있어요. 아주 심하지는 않아서 아침에 대웅제약 스타빅 한포씩 먹으니 하룻동안은 괜찮아요. 나름 음식, 음료 가려먹었는데도 그렇네요. 스타빅 사오시면 좋을것 같아요.', '오 스타빅 메모 하겠습니다 저는 장티푸스 주사는 이미 늦어버려서 2주전에는 맞아야 한다는데 ㅜㅠ\n도움 감사합니다', '저도 걱정이 됐었는데 물은 무조건 생수 사 드시고 수영장은 유소아들이 많이 노는 곳이라면 좀 더 위험성이 있으니 물 삼키지 않도록 주의하시면 괜찮을 것 같아요. 혹시 모르니 미리 배탈약 준비하시면 되구요 미리 너무 걱정하시면 불안때문에 즐거운 여행이 지장이 갈 수 있으니 걱정에 깊이 빠지지는 마세요. 참고로 저와 아이들 모두 발리밸리 없이 갔다 왔어요.', '좋은 말씀 감사합니다\n저도 최대한 조심하겠지만 이넘의 몸뚱아리라 버텨주길 기도하는 수 밖에 없겠네요\n감사합니다', '약 챙겨올 필요 없는거 같아요. 어짜피 효과 없어요 ㅜ 로컬병원 9-10시까지 하니까 어른들은 거기서 수액 맞으면 효과 제일 좋은거 같아요.', '그렇군요 ㅜㅠ\n어휴 거기서 또 병원 갈 생각하면 진짜 끔찍하네요 감사합니다!!', '혹시 발리에서 탈이 난다면 imodium 이라는 현지 약을 드세요. 약국에 팔아요. 전 발리에 살고 있고요, 발리밸리랑 배탈은 한국약 잘 안들어요. 저 약이 가장 잘 들어요! 식중독땜에 열나면 해열제 panadol을 함께 드시면 됩니다~~', '오 정말 정말 감사합니다 🙏']",
바퀴벌레약,"리조트에 바퀴벌레 많다는데
걱정이네요.
바퀴벌레약을 현지에서 사야하나....
현지에서 바퀴벌레약 사신분 계시나요?
",[],
현지 소염진통제,"3일째 걷고있어요!
어제부터 발바닥 바깥쪽이 아픈데 오늘은 그게 발목까지 올라오네요

소염진통제를 챙긴줄알았는데 놓고온거같아서 현지에서 사려고 하는데 Analgésico antiinflamatorio(번역) 소염진통제 달라고 하면 살수있겠죠?
아님 현지 약 아시는거있음 알려주세요ㅠㅡㅠ","['바르는 약품\nvoltaren\nvotadol\nsalvacam\n\n먹는 약품\nibuprofeno\nnaproxeno', '감사합니다!', '1. 하루 쯤 쉬는것도 좋은 방법\n2. 출발 전 스트레칭\n3. 도착 후 스트레칭\n도착 후 족욕(찬물에 10분쯤 담구기)\n발을 위로 하여 누워서 쉬기(30분)\n\n참조\nhttps://youtu.be/FSCBPctbdWs?si=XCJvgFM0HqWsv3p0', '감사합니다 싸부님! 오늘 일요일이라 약국도 열은곳 찾아서 말씀해주신 약사고 일부러 더 안걷고 숙소 체크인만 기다리고 있어요!!']",
개미약 현지에서 구입해보신분 계실까요?,"오늘 솔레아 첵인햇는데 스파동 가든쪽이라 그런지
개미가 ... ㅠㅠ 수영장 근처서도 많이 보이더니 이분들이
룸에도 있네요

애가둘이라 방에서 뭘 안 먹을 순 없고 ㅠㅠ 특히 단거요..
프런트 얘기하면 그때 그때 와서 뿌려주고 가는데 나 계속 필요하니 그 스프레이 주고 가라니까 안된데요 ㅋㅋ ( 이건 다들 그런가바요 전에 마리바고도 절대로 안주고 계속 부르라고..)
열 받아서 낼 세이브모어나 메트로마트인가 나가서 살까바요

프론트에서 뿌려주고 나면 담날 개미들이 사라지긴 하는건지...
방을 바꿔달라니 풀북이라 안댄다고만 하고 ㅠㅠ

한방에 싹 죽여버리는 좋은 현지 약품? 또는 방법 아시면 추천 부탁드려요 침대에도 올라올까바 이시간 잠못들고 있네요 ㅠ

참! 얘네도 혹시 사람 물까요? ㅠ ㅠ 한국개미에ㅡ비함 정말 연하고 작아요 보이는 족족 꾹 눌러죽이고싶을만큼 다행히 작네요 ㅋㅋ","['바이곤이었던거 같아요~', '바이곤!! 기억해둘게요 감사합니다!', '이거 엄청 독해요. 눈따갑고 냄새나고\n전 알콜뿌려요.\n마트에 70%알콜 사다가\n침대 시트, 쓰레기통등 뿌리면 좀 덜해요.\n거의 안보이더라고요.', '알콜도 방법이었군요! 마트가서 한번 찾아볼게요 감사드려요', '나비야아랫분이 말씀하신 스틱형, 분필같이 생긴거\n효과 정말 짧아요.. 첨에만 없어지는것 처럼 보여요', '며칠이나 계시나요? 개미약은 테로리퀴드(현지인들은 떼로리퀴드라고 해야 알아들어요)가 장기적으로 효과 좋은데 여행이면 단기이니 테로리퀴드 스프레이를 본 적이 있는데 그거 사용하시면 효과는 좋을것 같아요. 근데 며칠 안계실거면 윗분 말씀데로 알콜 단기적으로는 효과적입니다. 필리핀 마트에는 워낙 알콜 종류많고 다양하고 저렴하게 팔아요. 특별한 향 없는걸로 골라서 뿌리시면 될거예요', '확실히 프론트에서 스프레이 작업 이후 아직까진 잠잠하네요 알콜 한번 도전해볼게요!', '애들이 있어서 스프레이타입은 써본적 없지만 스틱형은 써봤어요.개미 보이는 곳이나 다니는 길목에 쓱쓱 그어두면 신기하게 안보이드라구요.바이곤거구요 마트 어디든 팔아용!', '오 스틱형 조으네요 이걸로 하나 구입해볼까바요 감사합니다:)', '쇼핑몰가면 바퀴모기개미 한번에죽이는스프레이있어요. 그거한통사서 아침 점심 저녁 뿌리면좋아요', '베이어 Bayer (독어로 바이엘) 의 Baygon 베이건 현지애셔 찾아 보세요 모기 용 부터 다양해요', '바이런이든뭐든 뿌리고 스틱이고 다 안되요... 이름은 모르겠는데 주사기에 든 개미약 있습니다.. 300페소 가량 하구요 매우소량(1회분.사악한가격 ㅠ) 주사기에 들어있어요 그거 군데군데 놓으시면 개미한마리 못보실꺼예요 한달동안 개미노이로제 시달리며 바이런이니 스틱이니 뭐니 다 쓰고도 해결안된집.. 주사기 개미약을 사용하고선 집에서 과자 흘리며 먹어도 개미한마리 안보여요.. 약 이름은 몰라서 죄송하네요 하지만 주사기에 든건 한가지일듯해요 바퀴용 아니고 꼭 개미용 구입하셔야 하구요..', '이거네요.. 이건 바퀴용 사진인데 개미용 따로 있어요^^ 짜실때 힘 팍 주면 한번에 다 나와버리니 조금씩 힘조절 하시면서 개미 보이는곳에 짜시면 1분이내로 개미들이 엄청 먹을꺼예요 그러곤 유유히 사라져요(개미집으로 가서 전파시킨다고 하더라구요)', '안녕하세요 마트에가시면 초크형 스프레이형 등 종류가 다양하게 구비되어 있습니다.다만 잘 알려진 바이곤스프레이나 스틱형은 개미는 잘 죽지 않드라고요. 전 라이언 타이거 스프레이 추천드립니다. 약이 좀 독하니까 애들 없을때 뿌리시구요. 효과는 보증해드립니다.', '감사해요 ㅜ']",
사이판 여행 필수 준비물 (안챙겨가면 아쉬워요),"알레르기약 (현지 마트에서 쉽게 구할수 있으니 알고 가세요)
알레르기 약이 필요한 경우가 많아요 알레르기는 생각도 안 하고 갔었는데
한국에서 알레르기가 난적이 없었어서요
근데 가니까 피부 뒤집어지고 찬물만 들어가면 빨게지더라구요
한국에서 미리 사가시기는게 좋아요
현지 마트에서도 쉽게 구할수 있다고해서 발랐는데
저랑은 안 맞는지 배가 아팠어요


썬블럭 (썬스틱)
썬크림만 챙겨가시죠?? 썬크림만 바르면 예쁘게 탑니다 ㅎㅎ
태닝해야지 하지마시고 한국이랑 햇빛도 달라요
썬블럭까지 꼭 가져가세요 완전 코팅되는 느낌? 덧바르기도 편해요
자기전에 씻으면 썬블럭까지 바른 부분은 원래 피부 그대로에요~
그리고 여기저기 사봤는데 썬스틱은 그냥 올영 싼거 브랜드로 사면 돼요
그게 그거였어요

쿨 담요
일반 담요 챙겨서 다니다가 쿨담요라고 있길래
쿨 담요 챙겨갔는데 엄청 유용했어요
일반 담요 챙겨가면 공항에서만 쓰고 안 써서 부피만 크고 짐인데
부피가 작은데다가
공항에서도 쓰고 현지에서도 어디 누워있거나 더울때도 덮고있으면 착 붙는게 시원해서 요긴하게 썼어요!!

지퍼백
수영하면 옷이 젖어서 생각보다 불편해요 급한 상황에서 말리기도 힘들고
지퍼백 크기별로 몇개씩 챙겨가세요
pic에서 이것저것 카드 가지고 다녀야 하는데 젖지도 않고 유용하게 썼어요
부피랑 무게도 차이 안 나니까 꼭 낱장으로 사이즈별로 챙겨가셔요!

아쿠아슈즈
말이 필요없어도 물놀이 하시면 필수에요
슬리퍼는 X

빨랫줄 빨래집게
숙소들이 건조대가 작고 건조대가 커도 둘이가는거 아닌이상
널어야 할게 많아서 부족해요 꼭 챙겨가세요


상비약 세트
두통약, 해열제, 인공 눈물 (수영하면 생각보다 결막염약 같은거 많이 필요함), 소화제, 복통약, 지사제, 연고 반창꼬, 방수밴드, 알로에, 화상연고 등
-한국에서 안 아파도 현지가면 새로운 환경+ 피로+ 음식 등등 아플거리가 너무 많아요 꼭 챙겨가세요


손선풍기
이건 호불호가 좀 있어요...
한국에서도 요긴하게 잘 쓰신 분들이면 가져가셔도 괜찮아요

멀티탭
숙소마다 다른데 콘센트 부족할수도 있어서 꼭 챙겨가세요!


샤워필터
다이소 5천원인가 그거 일정별로 사가시는게 좋아요
저도 안챙겨가자 주의였는데 필터로 갈고 물 몇번 틀어보니까 필터 색 바뀌는거 보고
무조건 챙겨가요
좋은거 아무 의미없어요 다이소껄로만 챙겨가시면 됩니다


외에도 본인만의 꿀템 있으시다면 공유해주세요~

","['유용한정보 감사합니다:)', '필터는 조금 더 좋은걸 권해드려요. 다이소 필터는 녹물만 걸러주고, 석회는 못걸러줘서, 석회까지 걸러주는걸 추천드려요', '22사이판은 석회수라 석회 걸러지지 않는 필터는 그닥 의미가 없다고 생각해요', 'pic가는데 샤워기필터필수일까요?\n좋은정보감사합니다 썬스틱사야겠어요!', '석회질 물 때문에 린스 대신 트리트먼트요\n그나마 뻣뻣해지는 머리결을 잡아주네요^^*', '좋은 정보 감사해요!', '유용한 정보네요~ 감사합니다~', '방수가방,아이스팩 있으면 좋아요!', '알레르기약달라고 하면 약국에서 주나요?\n약이름 알 수 있을까요?', '근데 약이라서 말씀드리기가 조금 조심스러운데\n제일 많이 먹는 약은 지르텍 많이 먹어요\n알레르기 하면 대부분 지르텍 드시더라구요\n저도 지르텍 챙겨갔어요~', '오지랖일수도 있지만\n꼭 약사분이랑 상담하고 드세요 ㅎㅎ', '사이판여행일지네 감사합니다', '어린이는 세노바 챔프파란색', '유용한 정보 감사해요^^', '샤워필터 말씀들이 많으시네요 ㅜㅜ']",
하나어학원 8주차 현지적응완,"어느덧 8주차 입니다~
이젠 익숙해져서 현지 야장 뽀개기(?)합니다욥ㅋ
여기 음식 싸고 맛은 뭐 쏘쏘입니다만ㅎ
현지 느낌 뿜뿜
원하는 가게에 앉아서 술시키고~다른 포차에서 음식사와서 먹어도 되는것 같아요~~
술은 무조건 버켓으로 시켜야한다는 사실을 배웠습니다ㅋㅋ
가격도 더 싸고~ 얼음 가득가득 !!
가게에 따라서 얼음컵도 줍니다~
필리퓐 스타일~~!!


현지 크리스마스 빌리지 일루미네이션 다녀왔습니다~
하나어학원에서 거리가 좀 멀기도하고 주말저녁이라
그랩이 안잡혀서 포기하고 뉴포인트몰 갔는데
그동네에서 바로 잡히더라구요~
가격은 아이 어른 상관없이 200페소기는 한데ㅋ
진~~~짜 현지인 엄청 많아요 ㅎㅎ
약간(?) 디즈니 짝퉁 느낌으로 코스튬 한 사람들 많구~
사진 찍으려면 팁 내야합니다욥ㅋ

태풍오는 일요일입니다ㅠ
오늘 늦은오후에 태풍 올것 같아서
아침9시에 sm 클락 왔는데 미사드리고있네요
내사랑 제이코도넛은 외부랑 연결된문으로 그시간에 들어갈수있구요 sm자체는 10시 땡 쳐야 들어갈수있습니다
제이코 도넛 풀로 채워져 있는거 첨봐서 기념으로다가ㅋ
sm클락에 자그맣게(진짜 겁나작아요) 아이스링크있습니다
원래 바닥분수있던자리 10월부터 바뀐것 같은데
ㅋㅋㅋ 가격이 사악합니다ㅠ 한국보다 더 비싼듯ㅠ
양말 없어서 100페소주고 사 신겼지용ㅋ
뭐~애들은 좋아합니다 ㅎㅅㅎ
갑자기 아침 저녁 기온도 내려가고~
감기걸려서 하나어학원 근처 약국왔습니다ㅠ
아~~약 엄청 비싸요ㅎㅎ
필리핀에서 파는 알콜5프로 섞인 마운틴듀~를
일본 친구와 도전해봤는데....
음ㅋ 제 스타일은 아닌걸로ㅋㅋ
일본친구는 맛있다고 한개 더 사와서 마셨습니다~
지난 금요일 던킨1+1 행사 진행했습니다~
하나어학원의 가장 큰 장점은!! 바로 코앞에 던킨이 있다는겁니다~~ 졸리비 차우킹 카페 마사지 슈퍼!!
이게 도보상권인곳과 아닌곳의 차이는 엄~~청 큽니다!!
근데 저 던킨 맛없..ㅠ 한국 던킨보다 맛없어여ㅠ
역시 이동네는 제이코가 최고입니다^^
요즘 원장님이 주말아침9시부터인데
먹깨비 두마리는 그 시간까지 못버티죠ㅎㅎ
평소처럼 7시반에 나타나 빵먹으려는데
저희땜시 아침준비 더 빨리해주시네요ㅠ
쏘 스윗ㅠㅠ
오늘도 즐거운 하나어학원 입니다~","['감기걸렸어~~? 타국에서 아픔 서러워~아프지마~ㅠㅠ', '감기 엄청 심하게 왔는뎅ㅠ 오전에 타이레놀 때려먹고 야장가서 술마시고ㅋㅋ 푸핫!!', '그나저나 너무바쁜거아냐~? 공부도열시미 노는것도 열시미~쵝오네^^ 저술은 다먹고 온거야?', 'ㅋㅋㅋ 태풍오기전에 후딱 놀고 빨리 들어갈거임ㅋ 뭐 술은 다 먹었겠죠?ㅎㅎ', '야옹', '제이코도넛을 안주삼아 드셔도 좋을것 같단 생각이 왜 드는거죠ㅋㅋ\n이뿐이도 고새 더 큰것 같아요~\n남은시간 후회없이 잘 보내다 오세욤♡', '제이코도넛을 안주삼아~~\n담번에 도전해볼게욥!!!', 'J.CO 도넛 괜찮습니다. 저는 던킨보다 J.CO 도넛을 더 좋아해서 ㅋㅋㅋ', '저도 제이코만 먹는데 던킨 행사에 속았네요ㅋㅋ', '야옹어학원연수 기간에만 있으실거면 적응하셔서 다행입니다~\n만약 자녀를 현지 학교에 보내실 계획도 있으시다면 지금까지 적응하신건 빙산의 일각이라는거~~~~~~^^\n그래도 큰 사고없이 잘 지내시는거 같아서 좋아보입니다. 무탈하게 지내는게 제일이죠.^^', 'Shiz넵~~!! 울 애들은 한국학교 그리워해서 돌아갈겁니다~~!! 큰사고없이 이대로만 지냈으면 좋겠네요~~^^', '부지런히 여러곳 신기한곳 재미진곳 다녀둬요\n곧 갑니다ㅎㅎㅎ\n여전히 브라이언 원장님은 서윗하시군요 ^^', '얼른오십쇼~ㅋㅋ 기댕기고 있슴돠!!\n원장님은 항상 스윗!!\n근데 지금 태풍왔으여ㅋㅋ 일단 정전에 대비합니다', '일루미네이션 볼만한가요? 이런게 있는지 몰랐네요😆😆', '그냥 저냥 볼만합니다ㅋㅋ 여름 크리스마스 즐기러 가는건데 멀어서ㅠ 울 애들이 보라카이 가는게 더 가까웠다며ㅎㅎ', '야옹아👉🏻👈🏻그럼 패스해야겠어여🤣🤣🤣', '하하형제맘저녁에 가야되는데ㅠ 그시간은 트래픽이 어마무시 어마무시 합니다ㅠ', '야옹그쵸ㅜㅡㅜ 남은 2주 잘 보내봐야겠어요😆😆', '하하형제맘4주 금방이죠!! 진짜 후딱 갑니데이 ㅋㅋ\n근데 그 처음4주가 세상 힘들고 그 뒤는 할만해요ㅋㅋ', '던킨에 초코방방만 드셔보세요ㅋㅋ이거 아이들 좋아해요 초코범벅에 슈크림들어있어서 ㅋㅋ존맛입니다.ㅋㅋ던킨 다른건 다맛없어요', '오우!! 좋은정보 감사합니다!! 던킨 빵 자체가 퍽퍽?해서 그런가 다 맛없었네요ㅠ 도전해보겠습니당!!', '야옹ㅋ맞아요 다맛없쥬...ㅠㅠㅋㅋㅋㅋ아이들어리면 드셔보세요 저희아이들은 엄지척했어요', '소향엄지척!! 아니 던킨을 코앞에두고ㅠ 진짜 걸어서 50미터쯤 되려나요ㅠ 매번 그랩잡아서 먼동네가야 제이코가 있거든요ㅠㅠ', '야옹ㅋㅋㅋ클락sm에 생겼나봐요 10년전에 마퀴몰에 처음생겼을땐 3시간씩 기다렸답니다...ㅋㅋㅋ혹시 하나어학원은 어떠신가요?ㅋㅋㅋ궁금하긴한데 시간되시면 채팅한번 드려도 될까요?ㅋ', '소향전 만족합니다~~!! 궁금하신거 다 답해드리지욥ㅋ 선생님부터 준비물까지 다 알려드립니다ㅋ', '이제 로컬 뚫기 시작하셨으면 진짜 적응 완료죠 ^^ 저도 어학연수 처음 갔을때 적응되고 나서 로컬 맛집이나 야시장, 재래시장 찾아다니면서 그들과 섞이는걸 즐겼거든요 .\n\n그 나라에 가면 그나라 문화를 알면 언어도 보인다고 했듯이 다 도움되실겁니다. ^^ 비싼 리조트 한번보다 나중에는 이런게 더 추억에 깊게~ 남으실거에요 ^^ 아이들은 여전히 이쁩니다. ^^', '옙~~! 저 이제 말 잘듣습니다ㅋㅋ\n로컬 야장 뽀개기 하겠슴돠~~!!', '야옹정말 남들 위험하다고 가지 말라는곳도 ㅎㅎ 찾아가서 그들과 웃고 떠들고 하면서 즐기던 그때(?)가 그립습니다.\n\n아이들 데리고 그런곳은 못가보겠지만 갑자기 생각이 나네요 ^^ 앞으로도 버킷리스트 하나씩 지워가세요 ~', '부운영자 l 젊은마왕오우~~!! 역시 대단하시네욥ㅋ\n전 그런 깜냥은 안됩니다~버킷 하나씩 지워가겠습니다!!']",
